{
  "schema_version": "1.0.0",
  "contract_type": "IncidentAlert",
  "workflow_id": "wf_01",
  "correlation_id": "corr_01",
  "causation_id": "evt_12",
  "timestamp_utc": "2026-04-08T10:23:00Z",
  "originator": {
    "type": "service",
    "id": "monitoring_service"
  },
  "environment": "paper",
  "operating_mode": "MODE-001",
  "payload": {
    "incident_id": "inc_01",
    "severity": "warning",
    "alert_type": "stale_market_data",
    "summary": "Market snapshot exceeded configured freshness threshold.",
    "source": "monitoring_service",
    "related_refs": ["mktsnap_01", "wf_01"],
    "recommended_action": "Pause new entries until fresh market data is available.",
    "incident_state": "open"
  }
}
